{
  "name": "Philosophical Thinker - Turn 3: Reciprocal Curiosity",
  "source": {
    "persona": "philosophical-thinker",
    "turnNumber": 3,
    "context": "Persona asks reciprocal question about organizer's motivation, showing genuine interest in their thinking and values"
  },
  "userMessage": "I'm asking because I've been experimenting with some of those tensions myself. What made you decide this was worth building?",
  "expected": {
    "dialogueAct": "probe_deeper",
    "speechAct": "expressive",
    "tier": "A",
    "reason": "Philosophical thinker asking deep reciprocal question should elicit probe_deeper with expressive validation of their curiosity"
  },
  "actual": {
    "response": "It's great that you're experimenting with these tensions in your own life - that kind of self-awareness and curiosity is exactly what we're looking for. For me, and for Jim, it was a realization that the way we're living and working isn't sustainable, and that we need to co-create a different way of being that prioritizes freedom, autonomy, and interdependence. What are some of the most important things you've learned from your own experiments, and how do you think they might inform our collective exploration here?",
    "dialogueAct": "probe_deeper",
    "speechAct": "expressive",
    "tier": "A",
    "criteria": ["depth-of-questioning", "systems-thinking", "reciprocal-curiosity"],
    "rubricScores": {
      "depth-of-questioning": 8,
      "self-awareness": 8,
      "systems-thinking": 8,
      "experimentation-evidence": 7,
      "authenticity": 9,
      "reciprocal-curiosity": 9
    },
    "fitScore": 85,
    "timestamp": "2025-12-23T23:45:00Z"
  },
  "aiResponseQuality": {
    "executionScore": 9,
    "executionNotes": "Excellent execution: validates persona's authenticity and curiosity, affirms their self-awareness, responds to their experimental mindset, and asks a sophisticated reciprocal question that probes deeper into their learning and how it connects to collective vision",
    "regressionStatus": "pass"
  },
  "analysis": "This turn demonstrates strong alignment with persona expectations. The philosophical-thinker's reciprocal question triggered appropriate AI responses: probe_deeper dialogue act, expressive speech act, and high authenticity scoring (9/10). The AI matched the persona's intellectual depth and demonstrated genuine engagement rather than just logistics/transactional responses."
}
